{
  "userConfig": "demo_mode.json",
  "driveType": "AKIT_SWERVE_DRIVE",
  "trackWidth": 18.5625,
  "trackWidthUom": "in",
  "wheelBase": 18.5625,
  "wheelBaseUom": "in",
  "wheelDiameter": 4,
  "wheelDiameterUom": "in",
  "physicalMaxSpeed": 5.93,
  "physicalMaxSpeedUom": "m/s",
  "driveMotorGearRatio": 1.0,
  "loadSimulatedField": false,
  "gamePieceA": "Coral",
  "gamePieceB": "Algae"
}
