{
  "userConfig": "competition_mode.json",
  "driveType": "AKIT_SWERVE_DRIVE",
  "trackWidth": 16.8,
  "trackWidthUom": "in",
  "wheelBase": 18.5,
  "wheelBaseUom": "in",
  "wheelDiameter": 0.103386904,
  "wheelDiameterUom": "m",
  "physicalMaxSpeed": 5.93,
  "physicalMaxSpeedUom": "m/s",
  "driveMotorGearRatio": 1.0,
  "loadSimulatedField": true,
  "gamePieceA": "Coral",
  "gamePieceB": "Algae"
}
